{
    "$schema": "http://json-schema.org/draft-07/schema#",
    "title": "LLM Configuration",
    "description": "Configuration for LLM providers in CoworkAny Sidecar",
    "type": "object",
    "required": [
        "provider"
    ],
    "properties": {
        "provider": {
            "type": "string",
            "enum": [
                "anthropic",
                "openai",
                "aiberm",
                "nvidia",
                "siliconflow",
                "gemini",
                "qwen",
                "minimax",
                "kimi",
                "openrouter",
                "ollama",
                "custom"
            ],
            "description": "Active LLM provider"
        },
        "anthropic": {
            "type": "object",
            "description": "Anthropic Claude API settings (base URL is fixed)",
            "properties": {
                "apiKey": {
                    "type": "string",
                    "description": "Anthropic API key"
                },
                "model": {
                    "type": "string",
                    "default": "claude-sonnet-4-5",
                    "description": "Model ID (e.g., claude-sonnet-4-5, claude-opus-4-5)"
                }
            },
            "required": [
                "apiKey"
            ]
        },
        "openrouter": {
            "type": "object",
            "description": "OpenRouter API settings (base URL is fixed)",
            "properties": {
                "apiKey": {
                    "type": "string",
                    "description": "OpenRouter API key"
                },
                "model": {
                    "type": "string",
                    "default": "anthropic/claude-sonnet-4.5",
                    "description": "Model ID (e.g., anthropic/claude-sonnet-4.5)"
                }
            },
            "required": [
                "apiKey"
            ]
        },
        "openai": {
            "type": "object",
            "description": "OpenAI-compatible settings used by OpenAI and built-in compatible providers such as Aiberm, NVIDIA NIM, SiliconFlow, Gemini, Qwen, MiniMax, and Kimi",
            "properties": {
                "apiKey": {
                    "type": "string",
                    "description": "API key for the selected OpenAI-compatible provider"
                },
                "baseUrl": {
                    "type": "string",
                    "description": "Full chat completions endpoint URL for the selected provider"
                },
                "model": {
                    "type": "string",
                    "default": "gpt-4o",
                    "description": "Model ID for the selected OpenAI-compatible provider"
                },
                "allowInsecureTls": {
                    "type": "boolean",
                    "default": false,
                    "description": "Disable TLS certificate verification for this provider (unsafe, use only in trusted internal environments)."
                }
            },
            "required": [
                "apiKey"
            ]
        },
        "ollama": {
            "type": "object",
            "description": "Ollama local model settings",
            "properties": {
                "baseUrl": {
                    "type": "string",
                    "default": "http://localhost:11434/v1/chat/completions",
                    "description": "Full Ollama chat completions endpoint URL"
                },
                "model": {
                    "type": "string",
                    "default": "llama3",
                    "description": "Local Ollama model ID"
                }
            }
        },
        "custom": {
            "type": "object",
            "description": "Custom third-party provider (base URL is configurable)",
            "properties": {
                "apiKey": {
                    "type": "string",
                    "description": "API key for the custom provider"
                },
                "baseUrl": {
                    "type": "string",
                    "description": "Base URL for the custom provider's API endpoint"
                },
                "model": {
                    "type": "string",
                    "description": "Model ID for the custom provider"
                },
                "apiFormat": {
                    "type": "string",
                    "enum": [
                        "openai",
                        "anthropic"
                    ],
                    "default": "openai",
                    "description": "API format: openai or anthropic"
                },
                "allowInsecureTls": {
                    "type": "boolean",
                    "default": false,
                    "description": "Disable TLS certificate verification for this provider (unsafe, use only in trusted internal environments)."
                }
            },
            "required": [
                "apiKey",
                "baseUrl",
                "model"
            ]
        },
        "maxHistoryMessages": {
            "type": "integer",
            "minimum": 1,
            "default": 20,
            "description": "Maximum number of conversation history messages to keep"
        },
        "search": {
            "type": "object",
            "description": "Web search provider settings for the search_web tool",
            "properties": {
                "provider": {
                    "type": "string",
                    "enum": ["serper", "exa", "tavily", "brave"],
                    "default": "exa",
                    "description": "Active search provider. Exa recommended for high-signal web research."
                },
                "serperApiKey": {
                    "type": "string",
                    "description": "Serper.dev API key (2500 free searches/month, no credit card needed). Get at https://serper.dev"
                },
                "exaApiKey": {
                    "type": "string",
                    "description": "Exa API key for Exa search / MCP-backed search workflows. Get at https://dashboard.exa.ai"
                },
                "tavilyApiKey": {
                    "type": "string",
                    "description": "Tavily API key for web search (1000 free/month). Get at https://tavily.com"
                },
                "braveApiKey": {
                    "type": "string",
                    "description": "Brave Search API key. Get at https://brave.com/search/api/"
                }
            }
        },
        "proxy": {
            "type": "object",
            "description": "Outbound HTTP(S) proxy settings for sidecar model requests",
            "properties": {
                "enabled": {
                    "type": "boolean",
                    "default": false,
                    "description": "Enable explicit proxy settings. When false, sidecar clears proxy env values from settings."
                },
                "url": {
                    "type": "string",
                    "description": "Proxy URL, e.g. http://127.0.0.1:7890 or socks5://127.0.0.1:1080"
                },
                "bypass": {
                    "type": "string",
                    "default": "localhost,127.0.0.1,::1",
                    "description": "Comma-separated NO_PROXY hosts/domains that should bypass the proxy"
                }
            }
        },
        "browserUse": {
            "type": "object",
            "description": "Browser-use AI automation service settings for smart browser mode",
            "properties": {
                "enabled": {
                    "type": "boolean",
                    "default": true,
                    "description": "Enable browser-use service integration. When false, only precise (Playwright) mode is available."
                },
                "autoStart": {
                    "type": "boolean",
                    "default": true,
                    "description": "Automatically start local browser-use-service when smart mode needs it and the endpoint is unavailable."
                },
                "serviceUrl": {
                    "type": "string",
                    "default": "http://localhost:8100",
                    "description": "URL of the browser-use FastAPI service"
                },
                "defaultMode": {
                    "type": "string",
                    "enum": ["precise", "smart", "auto"],
                    "default": "auto",
                    "description": "Default browser automation mode. 'precise' = Playwright CSS selectors, 'smart' = AI vision, 'auto' = try precise then smart"
                },
                "llmModel": {
                    "type": "string",
                    "default": "gpt-4o",
                    "description": "LLM model used by browser-use agent for visual understanding"
                }
            }
        }
    }
}
