{
    "$schema": "./llm-config.schema.json",
    "provider": "anthropic",
    "anthropic": {
        "apiKey": "sk-ant-your-api-key-here",
        "model": "claude-sonnet-4-5"
    },
    "openrouter": {
        "apiKey": "your-openrouter-api-key-here",
        "model": "anthropic/claude-sonnet-4.5"
    },
    "openai": {
        "apiKey": "your-provider-api-key-here",
        "baseUrl": "https://api.openai.com/v1/chat/completions",
        "model": "gpt-4o"
    },
    "custom": {
        "apiKey": "your-aiberm-api-key-here",
        "baseUrl": "https://aiberm.com/v1/chat/completions",
        "model": "claude-sonnet-4-5-20250929-thinking",
        "apiFormat": "openai",
        "allowInsecureTls": false
    },
    "maxHistoryMessages": 20,
    "search": {
        "provider": "exa",
        "serperApiKey": "",
        "exaApiKey": "",
        "tavilyApiKey": "",
        "braveApiKey": ""
    },
    "proxy": {
        "enabled": false,
        "url": "http://127.0.0.1:7890",
        "bypass": "localhost,127.0.0.1,::1"
    },
    "browserUse": {
        "enabled": true,
        "autoStart": true,
        "serviceUrl": "http://localhost:8100",
        "defaultMode": "auto",
        "llmModel": "gpt-4o"
    }
}
